,contributor_firstname,contributor_lastname,amount,contributor_fullname
487,SEAN,PARKER AND AFFILIATED ENTITIES,7250000.0,SEAN PARKER AND AFFILIATED ENTITIES
19,,FUND FOR POLICY REFORM,6140000.0, FUND FOR POLICY REFORM
20,,FUND FOR POLICY REFORM (NONPROFIT 501 (C)(4)),3940000.0, FUND FOR POLICY REFORM (NONPROFIT 501 (C)(4))
12,,"DRUG POLICY ACTION - NON PROFIT 501C4, YES ON PROP. 64",3000000.0," DRUG POLICY ACTION - NON PROFIT 501C4, YES ON PROP. 64"
31,,NEW APPROACH PAC (MPO),2615000.0, NEW APPROACH PAC (MPO)
